<?xml version="1.0" encoding="UTF-8"?>
<book xmlns:xsi="http://www.w3.org/2001/XMLSchema-instance" xsi:noNamespaceSchemaLocation="book.xsd">
	<title xsi:type="bookTitleType">TCP/IP Illustrated</title>
	<author>John</author>
	<section id="1" difficulty="easy">
		<title xsi:type="sectionTitleType">1.Introduction</title>
		<section>
			<title xsi:type="sectionTitleType">1-1.Principle of TCP?</title>
			<figure width="100" height="100">
				<title xsi:type="figureTitleType">1-1-1.TCP</title>
				<image source="\Desktop\001.jpg"></image>
			</figure>
		</section>
	</section>
	<section id="2" difficulty="easy">
		<title xsi:type="sectionTitleType">2.Internet protocol</title>
	</section>
</book>